{"contract_version":3,"ax":0,"ay":2,"rivers":[{"id":1,"global_id":"35184372092323","order":1,"width_m":1.2,"discharge_m3s":0.095,"feeds":null,"ends":"sea","course":[[436,1024]]},{"id":2,"global_id":"35184372092331","order":1,"width_m":1.2,"discharge_m3s":0.094,"feeds":1,"ends":"junction","course":[[437,1024]]},{"id":3,"global_id":"35184372092469","order":1,"width_m":1.2,"discharge_m3s":0.1,"feeds":7,"ends":"junction","course":[[454,1024]]},{"id":4,"global_id":"35184372092605","order":1,"width_m":1.3,"discharge_m3s":0.116,"feeds":8,"ends":"junction","course":[[471,1024]]},{"id":5,"global_id":"35184372092791","order":2,"width_m":2.1,"discharge_m3s":0.3,"feeds":9,"ends":"junction","course":[[494,1024]]},{"id":6,"global_id":"35184372092909","order":2,"width_m":2.2,"discharge_m3s":0.313,"feeds":11,"ends":"junction","course":[[509,1024]]},{"id":7,"global_id":"35218731830830","order":1,"width_m":1.3,"discharge_m3s":0.107,"feeds":12,"ends":"junction","course":[[453,1025]]},{"id":8,"global_id":"35218731830965","order":1,"width_m":1.3,"discharge_m3s":0.121,"feeds":13,"ends":"junction","course":[[470,1025]]},{"id":9,"global_id":"35218731831166","order":2,"width_m":2.2,"discharge_m3s":0.311,"feeds":14,"ends":"junction","course":[[495,1025]]},{"id":10,"global_id":"35218731831261","order":2,"width_m":2.2,"discharge_m3s":0.321,"feeds":15,"ends":"junction","course":[[507,1025]]},{"id":11,"global_id":"35218731831267","order":2,"width_m":2.2,"discharge_m3s":0.316,"feeds":10,"ends":"junction","course":[[508,1025]]},{"id":12,"global_id":"35253091569198","order":1,"width_m":1.3,"discharge_m3s":0.108,"feeds":16,"ends":"junction","course":[[453,1026]]},{"id":13,"global_id":"35253091569326","order":1,"width_m":1.4,"discharge_m3s":0.123,"feeds":17,"ends":"junction","course":[[469,1026]]},{"id":14,"global_id":"35253091569534","order":2,"width_m":2.2,"discharge_m3s":0.314,"feeds":18,"ends":"junction","course":[[495,1026]]},{"id":15,"global_id":"35253091569621","order":2,"width_m":2.2,"discharge_m3s":0.327,"feeds":19,"ends":"junction","course":[[506,1026]]},{"id":16,"global_id":"35287451307566","order":1,"width_m":1.3,"discharge_m3s":0.114,"feeds":null,"ends":"sea","course":[[453,1027]]},{"id":17,"global_id":"35287451307693","order":1,"width_m":1.4,"discharge_m3s":0.123,"feeds":20,"ends":"junction","course":[[469,1027]]},{"id":18,"global_id":"35287451307902","order":2,"width_m":2.2,"discharge_m3s":0.315,"feeds":21,"ends":"junction","course":[[495,1027]]},{"id":19,"global_id":"35287451307981","order":2,"width_m":2.3,"discharge_m3s":0.334,"feeds":22,"ends":"junction","course":[[505,1027]]},{"id":20,"global_id":"35321811046054","order":1,"width_m":1.4,"discharge_m3s":0.124,"feeds":24,"ends":"junction","course":[[468,1028]]},{"id":21,"global_id":"35321811046271","order":2,"width_m":2.2,"discharge_m3s":0.316,"feeds":25,"ends":"junction","course":[[495,1028]]},{"id":22,"global_id":"35321811046341","order":2,"width_m":2.3,"discharge_m3s":0.338,"feeds":26,"ends":"junction","course":[[504,1028]]},{"id":23,"global_id":"35321811046381","order":1,"width_m":0.8,"discharge_m3s":0.04,"feeds":27,"ends":"junction","course":[[509,1028]]},{"id":24,"global_id":"35356170784421","order":1,"width_m":1.4,"discharge_m3s":0.128,"feeds":28,"ends":"junction","course":[[468,1029]]},{"id":25,"global_id":"35356170784646","order":2,"width_m":2.2,"discharge_m3s":0.321,"feeds":29,"ends":"junction","course":[[496,1029]]},{"id":26,"global_id":"35356170784702","order":2,"width_m":2.3,"discharge_m3s":0.343,"feeds":30,"ends":"junction","course":[[503,1029]]},{"id":27,"global_id":"35356170784741","order":1,"width_m":0.8,"discharge_m3s":0.043,"feeds":31,"ends":"junction","course":[[508,1029]]},{"id":28,"global_id":"35390530522781","order":1,"width_m":1.4,"discharge_m3s":0.132,"feeds":32,"ends":"junction","course":[[467,1030]]},{"id":29,"global_id":"35390530523014","order":2,"width_m":2.2,"discharge_m3s":0.324,"feeds":33,"ends":"junction","course":[[496,1030]]},{"id":30,"global_id":"35390530523069","order":2,"width_m":2.3,"discharge_m3s":0.345,"feeds":34,"ends":"junction","course":[[503,1030]]},{"id":31,"global_id":"35390530523102","order":1,"width_m":0.8,"discharge_m3s":0.046,"feeds":35,"ends":"junction","course":[[507,1030]]},{"id":32,"global_id":"35424890261141","order":1,"width_m":1.4,"discharge_m3s":0.134,"feeds":36,"ends":"junction","course":[[466,1031]]},{"id":33,"global_id":"35424890261383","order":2,"width_m":2.2,"discharge_m3s":0.325,"feeds":37,"ends":"junction","course":[[496,1031]]},{"id":34,"global_id":"35424890261430","order":2,"width_m":2.3,"discharge_m3s":0.349,"feeds":38,"ends":"junction","course":[[502,1031]]},{"id":35,"global_id":"35424890261469","order":1,"width_m":0.8,"discharge_m3s":0.048,"feeds":39,"ends":"junction","course":[[507,1031]]},{"id":36,"global_id":"35459249999501","order":1,"width_m":1.4,"discharge_m3s":0.138,"feeds":41,"ends":"junction","course":[[465,1032]]},{"id":37,"global_id":"35459249999759","order":2,"width_m":2.2,"discharge_m3s":0.327,"feeds":42,"ends":"junction","course":[[497,1032]]},{"id":38,"global_id":"35459249999797","order":2,"width_m":2.3,"discharge_m3s":0.35,"feeds":43,"ends":"junction","course":[[502,1032]]},{"id":39,"global_id":"35459249999829","order":1,"width_m":0.8,"discharge_m3s":0.05,"feeds":44,"ends":"junction","course":[[506,1032]]},{"id":40,"global_id":"35493609737835","order":1,"width_m":1.5,"discharge_m3s":0.148,"feeds":null,"ends":"sea","course":[[461,1033]]},{"id":41,"global_id":"35493609737861","order":1,"width_m":1.5,"discharge_m3s":0.145,"feeds":46,"ends":"junction","course":[[464,1033]]},{"id":42,"global_id":"35493609738135","order":2,"width_m":2.2,"discharge_m3s":0.329,"feeds":47,"ends":"junction","course":[[498,1033]]},{"id":43,"global_id":"35493609738158","order":2,"width_m":2.3,"discharge_m3s":0.352,"feeds":48,"ends":"junction","course":[[501,1033]]},{"id":44,"global_id":"35493609738190","order":1,"width_m":0.9,"discharge_m3s":0.052,"feeds":49,"ends":"junction","course":[[505,1033]]},{"id":45,"global_id":"35527969476208","order":1,"width_m":1.5,"discharge_m3s":0.147,"feeds":40,"ends":"junction","course":[[462,1034]]},{"id":46,"global_id":"35527969476219","order":1,"width_m":1.5,"discharge_m3s":0.147,"feeds":45,"ends":"junction","course":[[463,1034]]},{"id":47,"global_id":"35527969476511","order":2,"width_m":2.2,"discharge_m3s":0.33,"feeds":50,"ends":"junction","course":[[499,1034]]},{"id":48,"global_id":"35527969476526","order":2,"width_m":2.3,"discharge_m3s":0.353,"feeds":51,"ends":"junction","course":[[501,1034]]},{"id":49,"global_id":"35527969476557","order":1,"width_m":0.9,"discharge_m3s":0.053,"feeds":54,"ends":"junction","course":[[505,1034]]},{"id":50,"global_id":"35562329214885","order":2,"width_m":2.3,"discharge_m3s":0.332,"feeds":60,"ends":"junction","course":[[500,1035]]},{"id":51,"global_id":"35562329214893","order":4,"width_m":7.6,"discharge_m3s":3.647,"feeds":61,"ends":"junction","course":[[501,1035]]},{"id":52,"global_id":"35562329214899","order":1,"width_m":0.9,"discharge_m3s":0.055,"feeds":51,"ends":"junction","course":[[502,1035]]},{"id":53,"global_id":"35562329214907","order":1,"width_m":0.9,"discharge_m3s":0.054,"feeds":52,"ends":"junction","course":[[503,1035]]},{"id":54,"global_id":"35562329214915","order":1,"width_m":0.9,"discharge_m3s":0.053,"feeds":53,"ends":"junction","course":[[504,1035]]},{"id":55,"global_id":"35562329214925","order":4,"width_m":7.1,"discharge_m3s":3.236,"feeds":64,"ends":"junction","course":[[505,1035]]},{"id":56,"global_id":"35562329214931","order":4,"width_m":7.1,"discharge_m3s":3.235,"feeds":55,"ends":"junction","course":[[506,1035]]},{"id":57,"global_id":"35562329214939","order":4,"width_m":7.1,"discharge_m3s":3.235,"feeds":56,"ends":"junction","course":[[507,1035]]},{"id":58,"global_id":"35562329214947","order":4,"width_m":7.1,"discharge_m3s":3.233,"feeds":57,"ends":"junction","course":[[508,1035]]},{"id":59,"global_id":"35596688953062","order":1,"width_m":0.8,"discharge_m3s":0.044,"feeds":66,"ends":"junction","course":[[476,1036]]},{"id":60,"global_id":"35596688953246","order":4,"width_m":7.9,"discharge_m3s":3.981,"feeds":70,"ends":"junction","course":[[499,1036]]},{"id":61,"global_id":"35596688953251","order":4,"width_m":7.6,"discharge_m3s":3.648,"feeds":60,"ends":"junction","course":[[500,1036]]},{"id":62,"global_id":"35596688953264","order":4,"width_m":7.1,"discharge_m3s":3.237,"feeds":51,"ends":"junction","course":[[502,1036]]},{"id":63,"global_id":"35596688953275","order":4,"width_m":7.1,"discharge_m3s":3.237,"feeds":62,"ends":"junction","course":[[503,1036]]},{"id":64,"global_id":"35596688953283","order":4,"width_m":7.1,"discharge_m3s":3.237,"feeds":63,"ends":"junction","course":[[504,1036]]},{"id":65,"global_id":"35596688953320","order":4,"width_m":7.1,"discharge_m3s":3.228,"feeds":58,"ends":"junction","course":[[509,1036]]},{"id":66,"global_id":"35631048691429","order":1,"width_m":0.8,"discharge_m3s":0.047,"feeds":73,"ends":"junction","course":[[476,1037]]},{"id":67,"global_id":"35631048691589","order":4,"width_m":8.7,"discharge_m3s":4.742,"feeds":74,"ends":"junction","course":[[496,1037]]},{"id":68,"global_id":"35631048691595","order":4,"width_m":8.6,"discharge_m3s":4.706,"feeds":67,"ends":"junction","course":[[497,1037]]},{"id":69,"global_id":"35631048691603","order":4,"width_m":8.6,"discharge_m3s":4.704,"feeds":68,"ends":"junction","course":[[498,1037]]},{"id":70,"global_id":"35631048691611","order":4,"width_m":8.6,"discharge_m3s":4.704,"feeds":69,"ends":"junction","course":[[499,1037]]},{"id":71,"global_id":"35631048691619","order":2,"width_m":3.3,"discharge_m3s":0.72,"feeds":70,"ends":"junction","course":[[500,1037]]},{"id":72,"global_id":"35631048691696","order":4,"width_m":7.1,"discharge_m3s":3.222,"feeds":65,"ends":"junction","course":[[510,1037]]},{"id":73,"global_id":"35665408429789","order":1,"width_m":0.9,"discharge_m3s":0.053,"feeds":78,"ends":"junction","course":[[475,1038]]},{"id":74,"global_id":"35665408429949","order":4,"width_m"